{
  "schema_version": 1,
  "target": "web",
  "device": "webgpu",
  "level": "short",
  "browser": "chrome",
  "browser_major": 130,
  "os": "macos",
  "os_major": 15,
  "cache_state": "warm",
  "model_id": "onnx-community/Qwen3.5-0.8B-Text-ONNX",
  "model_rev": "1e45daba048899e7f771657ada617ec49350aa91",
  "dtype": "q4f16",
  "doc_id": "011",
  "commit": "81092b9",
  "date": "2026-09-24T12:00:00Z",
  "machine_id": "web",
  "ttfa_ms": 5200,
  "gen_ms": 3100,
  "tok_s": 22.5,
  "rtf": 1.4,
  "gap_ms": 90,
  "stop_ms": 140,
  "coverage": null,
  "bullets_total": 5,
  "bullets_cut": 0,
  "cut_rate": 0.0,
  "facts_token_hit": 0.93,
  "halluc_flags": 0,
  "forbidden_hits": 0,
  "oneline_keyword_hit": null,
  "tts_overlimit": 0,
  "peak_mb": 540,
  "heap_mb": 310
}
